title,upvotes,url,body
"Using my parents’ down payment money, thank god I recovered 💵💰💸 $TSLA $NVDA",4871,https://v.redd.it/j6boyotceibd1,"Almost lost everything. These are all in trades, same week expiry and out the strike.
“It’s not the destination, it’s the journey” - Ralph Waldo Emerson "
TSLA bagholders 😂,21331,https://i.redd.it/rxg5f62jx16a1.png,
"Thanks to $TSLA, I’m buying a new wife for Christmas.",47308,https://i.redd.it/dnikavdy9ez71.jpg,
$TSLA: The DD of a lifetime. ,3879,https://www.reddit.com/r/wallstreetbets/comments/1gai1a7/tsla_the_dd_of_a_lifetime/,"Hello, everyone! As we all know, $TSLA is having their quarterly earnings, which is a big deal for some bears. But let’s crack down on the bear party just for a second and use *logical* reasoning for why TSLA might not end up in the gutter as many would think. 

1. Expectations are low, just like Q1 (will get back to this later).
2. Their shittiness is priced in already after Robotaxi event.
3. Elon Musk is a master stock manipulator. 

Keeping all of this in mind, this isn’t even the *real* part of this DD. The actual, most integral part is looking at Elon Musk’s Twitter, which I decided to keep a close look on the past couple of earnings reports. 

On the day of Tesla’s Q1, Elon Musk tweeted a total of 5 times, where the stock ended up going up 13% and then an additional 16% the next 2 weeks. 

On the day of Tesla Q2, Elon Musk didn’t tweet **anything**, and the stock ended up falling 14%. 

Seems like a pattern has been drawn up, huh? Elon tweets a bit when the Tesla stock is going to moon on earnings while he’s in a cocky mood, and is dead silent when Tesla is going to fall. 

Now guess how many times Elon Musk has tweeted *so far* today? 

*15 fucking times*. 

You heard that right, folks! 15 GODDAMN times. That’s triple the amount of tweets he had made on Q1, where the stock roared 13 - 15%! Meaning that Elon is much more confidence and cockier than he was in Q1! This man knows when his stock will fall and when it doesn’t, and he’s letting us know right below our own nose! 

All of this is a *clear* indicator that Tesla is going to the moon today and the next week to come, regardless of whether they beat estimates or not. I’m betting that Tesla WILL beat estimates simply because of Elon Musk’s tweets and the fact that everyone has low confidence in the stock as of late. 

This is your DD to buy calls. Whether you want free money or not is up to you. 

Positions: 15 minutes before market close, I’ll buy 3 217.5C exp. OCT. 25th. 

*note*: This is NOT financial advice. Any losses on $TSLA options deep OOTM is a result of your regardedness, not mine. "
What do you think is going through Elons mind right now now? TSLA earnings call tomorrow.,1970,https://www.reddit.com/r/stocks/comments/1k4m0wz/what_do_you_think_is_going_through_elons_mind/,"What do you think is going through Elons mind right now now? TSLA earnings call tomorrow. He is probably losing his mind…. Will TSLA hit 10$ in a few years, go bankrupt, or even with a new CEO, the brand is wrecked. "
