title,upvotes,url,body
89K short on TSLA for next week,386,https://i.redd.it/9gxnmhnspg5g1.jpeg,"Bought 200 TSLL DEC12 $25 puts today

DD : This is WSB I have no DD it's just pure gambling. Elon is a legendary regard and he wants a 1 trillion pay package on an overinflated company valued at 1.5 trillion. Let's see how this play out!"
3 Reasons why TSLA will dump to below 400$ before end of the Year,1883,https://i.redd.it/y94dkj8u62zf1.png,"Yeah ya'll just clicked because you saw that fancy chart huh? But in truth we all know TSLA is immune to everything.

Buuuuut

Reason one: TSLA will dump after 6 of Nov. because Musks 1T Package will be accepted and its already priced in.

Reason two: I got puts, and I am always winning.

Reason three: Never trust your gut, and my gut says TSLA will moon.

Thank you."
Burry’s right about TSLA ( or atleast i hope he is 🫠 ),106,https://i.redd.it/ki95mdt8345g1.jpeg,"Opened these right at the bottom. Still can’t comprehend how is this not below 400.

Holding till expiration."
$TSLA pattern literally paid cash for my entire Roadster,221,https://www.reddit.com/r/options/comments/1piulhv/tsla_pattern_literally_paid_cash_for_my_entire/,"It’s stupid pattern & super basic:

Two setups only:

1. Stock closes green + overnight is also green → next day usually opens higher… then dumps hard  
2. Stock closes red + overnight turns green → next day gaps up and finishes green most of the time

That’s it.

I checked the last ~18 months:  
- Double green → red day about 57% of the time  
- Red then green overnight → green day about 68% of the time

My lazy play:
Every time we get a red day + green overnight → I sell puts at the open (0DTE or next-day expiry, nothing crazy). Stock runs, premium melts, I buy the puts back for pennies or let them expire worthless. Rinse and repeat.

Double-green overnight days I either skip or buy some cheap puts for the fade.

Exception is when Elon drops a nuke tweet or real news hits.

Anyone else seeing this same thing?

NFA

Update:

Classic mean-reversion setup… It's essentially betting on overextension which is when the prior day and after-hours align in one direction (especially bullish), it often exhausts retail/institutional momentum, leading to profit-taking or short-selling the next morning. The red-day version works because the green overnight acts as a ""relief bounce"" after downside, shaking out weak hands before buyers pile in."
TSLA - expect sentiment shift after earnings,413,https://www.reddit.com/r/wallstreetbets/comments/1pohi6c/tsla_expect_sentiment_shift_after_earnings/,"With EV credits expired in the US as of end of Q3, early Q4 [reports](https://www.fool.com/investing/2025/12/15/predict-elon-musk-reveal-tesla-losing-money-stock/) are already showing EV sales down up to 60% YOY. Assuming Tesla car sales will also be impacted *(+ remaining headwind from the political turnoil earlier this year + Chinese EV competition in China and Europe)*, Tesla may go from unreasonable P/E to negative earnings. While last quarter was somewhat salvaged by the last minute demand to get in on the US EV credit, this won't be happening in Q4.

While this doesn't necessarily change the long term picture *(whether you buy AV + robots thesis or not)*, I do think this will spook investors quite a bit and force a reality check."
That’s it I’m shorting TSLA with 150% of my money,770,https://www.reddit.com/gallery/1ofbhjs,"TSLA has bad fundamentals with even worse earnings numbers. Elon musk is a clueless con artist and the top is in. This stock is going to 200s.

Position: short 200 shares of TSLA @ 433.56"
"TSLA's epic surge: With its core business collapsing, why did its stock price reach a new all-time high of $491.5?",1288,https://www.reddit.com/r/stocks/comments/1pofrbh/tslas_epic_surge_with_its_core_business/,"TSLA surged against the market trend today, reaching a new all-time high of $491.5, while Elon Musk's net worth soared to over $670 billion.  This stands in stark contrast to the company's core business struggles, including a nearly 40% drop in European sales and institutional forecasts of declining Q4 deliveries. The truth is: Wall Street has completely abandoned fundamental analysis of TSLA's automotive business. They are making a massive gamble that Musk will successfully transform into the core of an AI empire $1.6 trillion market capitalization is just the beginning. What they truly value is the $1 trillion profit potential of the FSD software, the multi-trillion-dollar market for CyberCab and Optimus robots by 2026, and the epic narrative of the SpaceX space economy behind it all. This high-risk gamble, which completely ties personal wealth, grand narratives, and extreme valuations together, means that TSLA is a bet that will either reach $3 trillion or see its dreams shattered.

At this point, would you buy at a high price, or would you wait and see?"
TSLA 700C LEAPS 2027 — Datacenters in Space,0,https://www.reddit.com/r/wallstreetbets/comments/1pnk24g/tsla_700c_leaps_2027_datacenters_in_space/,"Alright regards, quick thesis because attention spans here are shorter than a 0DTE lifespan.

I’m buying TSLA $700 LEAPS Jan 2027.

Not because of cars. Not because of deliveries.

Because you’re all still valuing Tesla like it’s an auto OEM while Elon is building compute infrastructure for the planet and beyond it.

The Actual Play: Compute, Power, Space

Everyone’s arguing PE ratios while Elon is on X talking about compute constraints being the real bottleneck for AI.

Now connect the dots:

xAI needs absurd amounts of compute

Tesla builds AI, chips (Dojo), power systems, cooling, energy storage

SpaceX owns launch + Starlink (global low-latency data backbone)

What do you get?

Datacenters in space / near-space

No land constraints

Solar power abundance

Global latency via Starlink

Energy storage via Tesla Megapacks

AI training + inference at planetary scale

This isn’t sci-fi. Elon has explicitly said power + compute are the limiting factors for AI — and he controls both.

Why Tesla Is the Trojan Horse

Tesla isn’t the product.

Tesla is the industrial base:

Energy generation

Energy storage

AI hardware

Robotics to build and maintain it

Try slapping a PE ratio on that. I’ll wait.

Risk?

Yeah, TSLA could easily nuke 50% in 6 months.

That’s why:

LEAPS

shares

TL;DR

You’re trading a car company

I’m betting on orbital compute infrastructure

Same story as always: sounds insane → works → too late"
Evaluating TSLA as It Approaches the $500 Leve,0,https://www.reddit.com/r/ValueInvesting/comments/1pf6tae/evaluating_tsla_as_it_approaches_the_500_leve/,"Recent market volatility has been largely driven by macro shifts, but Tesla (TSLA) continues to attract attention as it approaches the $500 mark. While sentiment is improving, the investment discussion still revolves around fundamentals margins, long-term competitive positioning, and how much future growth is already priced in.

For value-oriented investors, the main considerations remain Tesla’s ability to sustain profitability, scale its energy segment, and maintain cost advantages in a competitive EV landscape. A move above $500 would be notable, but the long-term thesis matters more than short-term price action.

For transparency, I personally monitor TSLA through a stock-futures product on my trading platform (Bitget) mainly as a way to track broader sentiment. This is not a recommendation just part of how I follow market movements while evaluating the underlying fundamentals.

Overall, I’m keeping a balanced view and focusing on whether future cash-flow potential justifies the current and potential valuation levels."
Don't celebrate the Fed Cut yet. TSLA is the canary in the coal mine and signals the market is facing a 25-30% correction in 2026,0,https://www.reddit.com/r/stocks/comments/1pj892w/dont_celebrate_the_fed_cut_yet_tsla_is_the_canary/,"I'm shorting this optimism. Everyone is glued to the screen waiting for the Fed to cut rates today, acting like it’s a foregone conclusion, and analysts are talking about S&P 500 hitting 7,500 in 2026. That's pure euphoria.

I look at one stock: Tesla (TSLA). Michael Burry, the ""Big Short"" investor, recently called the company ""ridiculously overvalued,"" citing shareholder dilution from stock-based compensation (SBC) and no buyback program.

1 - The Growth Narrative is Broken: The stock's valuation requires insane, uninterrupted growth, but the truck design is already controversial, and the competition is accelerating. It has an AI valuation but is fundamentally a car company.

2 - The EPS Overestimation: The bottom-up EPS estimate for the S&P 500 for 2026 is currently \$309.22. However, over the past 25 years, analysts have overestimated the final EPS number by an average of 6.2\%. Applying that average means the final 2026 EPS might be closer to \$290.11. This makes current high valuations extremely sensitive to any shock.

The market is showing extreme crowding and a ""winner-takes-all"" dynamic right now. When the high-momentum stocks like TSLA and other AI names start the rotation, the correction will be deep. I'm taking profits today. I’m not saying crash, but 25-30% pullback in 2026 is my base case. Roast me.

Important Note: I am not a financial advisor. This is NOT investment advice or a recommendation to buy or sell any security. This post represents my personal, non-professional opinion for discussion purposes only. Always do your own due diligence (DD) before making any investment decisions. I am not responsible for the outcome of your trades."
Is that why TSLA plummeted?,7806,https://i.redd.it/839bnces39af1.png,
"Lost $7,200 in TSLA... in 28 minutes.",12639,https://www.reddit.com/gallery/1jrhkc2,"At 10:19am I placed an order to buy 60 contracts of TSLA $240.00 Put... Was a market order and still didn't fucking place. So I canceled a couple minutes later. I would've made $20k.

At 10:47am I bought 32 contracts of TSLA $235.00 Put @ $279.00 per contract. TSLA skyrocketed ten fucking dollars right after.

At 11:17am I couldn't take it anymore and sold all 32 contracts of TSLA $235.00 Put for an average of $54.00 per contract.

\-$7,200 in 28 minutes. Tesla has beaten me down in the equity in my model 3 performance, in the stock market, and now in the form of options. I hate you Tesla.

Update (6 Months Later): If anyone stumbles onto this post and is wondering for an update... I've traded options twice since this post, lost about another $7,000, then stopped touching options altogether. I just toss all of my money into QQQ + VOO, have made a full financial ""recovery"" + am sitting on a cash pile of several times what I've lost in total lol. I had fun trading options, but they just don't like me!"
Tesla’s (TSLA) Electric Vehicle Sales Plunge Across Europe,19982,https://markets.businessinsider.com/news/stocks/tesla-s-tsla-electric-vehicle-sales-plunge-across-europe-1034304510,
"$80,000 to $1.12M in 7 days. Thank you Elon Musk! $TSLA",19498,https://www.reddit.com/r/wallstreetbets/comments/1gouy6r/80000_to_112m_in_7_days_thank_you_elon_musk_tsla/,"https://preview.redd.it/5i2pyzrxja0e1.jpg?width=1098&format=pjpg&auto=webp&s=c2f04c7bed78f9c752e85e916ed65fb1503dccc2

https://preview.redd.it/capdss2yja0e1.jpg?width=831&format=pjpg&auto=webp&s=7d7840950b254bfbef13d3c2bb56be8b2a0a005d

(Repost from 30 minutes ago because my post wasn't clear enough according to the mods)  
  
So, I wanted to bet on Tesla mooning as a result of Trump winning due to their new close relationship, and the deregulation that was coming for Tesla in the new administration. I'm not a political person, just trading off an idea!

So here's what I did:  
  
Bought $15,000 on 3:1 Kamala bets to win $30,000 to hedge my $50,000 in TSLA weekly calls. If she had won, I'd lose $10K-15K Max. If Trump won, this happens... Rolled my weekly calls to 29 Nov/ 20 Dec and held till today. Closed 95%."
Tesla (TSLA) accounting raises red flags as report shows $1.4 billion missing,14676,https://www.reddit.com/r/stocks/comments/1jfn3wn/tesla_tsla_accounting_raises_red_flags_as_report/,"“Tesla’s (TSLA) accounting practices are raising red flags as a new report from the Financial Times shows that $1.4 billion is missing.
Many Tesla shorts and detractors have questioned Tesla’s accounting for years, but they have never gained much traction – until now.
Today, the Financial Times has released a new report pointing to a $1.4 billion gap in assets:

**Compare Tesla’s capital expenditure in the last six months of 2024 to its valuation of the assets that money was spent on, and $1.4bn appears to have gone astray**.”


https://electrek.co/2025/03/19/tesla-tsla-accounting-raises-red-flags-as-report-shows-1-4-billion-missing/

Official FT article without paywall: https://archive.ph/2025.03.20-035200/https://www.ft.com/content/62df8d8d-31f2-445e-bfa2-c171ac43db6e"
TSLA Puts 90k to 609k,13493,https://i.redd.it/5hokymop5wne1.png,
"TSLA investors, beware",7229,https://www.reddit.com/r/stocks/comments/1j9qzgg/tsla_investors_beware/,"Trump's support of Tesla is a desperate and last ditch effort to save the falling stock. 

This is a pump and dump. He did that with the Trump & Melania meme coins, then with other shitcoins, and now TSLA. If you hold shares, this is your opportunity to dump them. Just my opinion. Not financial advice ;)"
"Video shows Tesla, $TSLA, Cybertruck explosion at the Trump Hotel in Las Vegas.",11040,https://v.redd.it/mo4dckay4gae1,"BREAKING: Video shows Tesla, $TSLA, Cybertruck explosion at the Trump Hotel in Las Vegas. Cause unknown.

Police confirm driver killed in Cybertruck explosion at Trump Hotel in Las Vegas, 7 others injured

"
All aboard the “dump $TSLA to save America” train.,16042,https://i.redd.it/iabfjewohiee1.jpeg,
TSLA being investigated by Transport Canada for cooking their books in Canada to snag EV rebates without selling cars.,18880,https://www.reddit.com/r/stocks/comments/1j7l0bv/tsla_being_investigated_by_transport_canada_for/,"The article notes that **four Tesla dealerships claimed to have sold 8,653 Teslas in 3 days.** Assuming each dealership opens from 9AM-5PM, that's **90 cars sold per hour per dealership**. Worth noting that Canada's EV rebate program was set to shut down, interesting how Tesla found 8,600 sales in 3 days before it did...

Ironic that Musk, who has recently repeatedly said that people who rely on government payments are leeches and that Canada is not a real country, is now accused of trying to leech off of Canadian taxpayer-funded EV rebates himself to the tune of $43M.

I guess that's one way to maintain revenue while sales drop 90%!

Note: investigation is ongoing and there has been no confirmation of official wrongdoing yet.

Edit: Since this post got more attention then I expected. Yes I posted this Sunday and TSLA is currently down 13% today. However I do not think this is causing the drop, and rather it’s an overall market pull back from trade wars and from Europe sales declines. The article was published Friday morning and Tesla was up 3% by end of Friday.  

[https://electrek.co/2025/03/07/tesla-made-a-suspicious-number-of-rebate-requests-on-last-days-of-canadian-ev-incentive/](https://electrek.co/2025/03/07/tesla-made-a-suspicious-number-of-rebate-requests-on-last-days-of-canadian-ev-incentive/)"
"Tesla (TSLA) sales are dropping like a rock in Europe, but it’s not just because of Elon Musk",12709,https://electrek.co/2025/02/03/tesla-tsla-sales-are-dropping-like-a-rock-in-europe-but-its-not-just-because-of-elon-musk/,
Tesla (TSLA) Stock: Trump's Purchase Fails to Sustain Rally,9678,https://moneycheck.com/tesla-tsla-stock-trumps-purchase-fails-to-sustain-rally/,
"Tesla (TSLA) announces 336,681 deliveries, far worse than expected",6739,https://electrek.co/2025/04/02/tesla-tsla-q1-deliveries-worse/,
Elon Musk does some standup comedy and advises investors to hold TSLA shares.,4847,https://v.redd.it/1bljxt61o3qe1,
TSLA IS PLAYING WITH FIRE,4744,https://www.reddit.com/r/wallstreetbets/comments/1j9tvrt/tsla_is_playing_with_fire/,"Tesla just lost almost all EV rebates looking forward which accounts for 44% of their revenue as president trump announced and under investigation by Canada caught doing fraud swapping Tesla’s for rebates, THIS IS JUST REBATES ALONE 

TSLA as everyone knows is getting a lot of shit for elons publicity and sales have plummeted more than 50% in Europe and Canada and in the USA it has dropped 26% and people that are still interested in the cars are scared to be buy or own bc of vandalized or public image

So if the company stops selling cars and stops getting money from governments around the world who’s going to prop it up?

Q2 is when the books will show all the free government rebate money that’s been pouring  money into Tesla for a decade has dried up the cat will be out of the bag 

And for the people saying Tesla is so much more blah blah robo taxi blah blah they aren’t even using lidar right now and there are multiple companies ahead of them in the space like BYD he’s just selling people dreams



Position 
35p 1/15/27 
45p 1/15/27
5p 1/15/27
100p 6/17/27

https://imgur.com/a/frTcitU
"
"LFG!!!!! TSLA this morning GOT ME INTO 6 FIGURES, INSANE MONTH OF TRADING!!!!! 2K start on April 8th",3240,https://www.reddit.com/gallery/1kijgwd,"Started April 8th with 2k after selling my car. Was broke as shit...now we're here holy fuck is this real?
Trades: MSTR and NDX 0DTES"
Tesla (TSLA) stock crash on new data from China: here’s what’s happening,5420,https://electrek.co/2025/03/18/tesla-tsla-stock-crash-new-data-china-whats-happening/,
"If TSLA pushes my account value above $25,000 can i sell the put i bought today? I already have 3 day trades this week.",3063,https://i.redd.it/gp98u67xs55f1.jpeg,If my value goes above 25k and i can close it all out will i still get restricted?
Tesla Stock Is Tumbling And Dave Portnoy Is Calling Out Elon Musk: 'How Far Does TSLA Stock Have To Crash Before Elon Goes Back To Work?',4945,https://finance.yahoo.com/news/tesla-stock-tumbling-dave-portnoy-133019141.html,
TSLA is done for.,3236,https://i.redd.it/jiiwxovkm8qe1.jpeg,
Tesla (TSLA) brand damage is destroying used car value: 'People don't want them anymore',5031,https://electrek.co/2025/04/18/tesla-tsla-brand-damage-destroying-used-car-value/,
Just dumped my remaining TSLA shares,5699,https://www.reddit.com/r/RealTesla/comments/1iu7xip/just_dumped_my_remaining_tsla_shares/,"TSLA has been my lifetime best performing investment, but I finally reached a breaking point with Musk's clear intention to break our democracy and bring in something new that we don't have a name for yet, but it resembles fascism. My first grandkid was just born, and I couldn't stomach continuing to make bank off of something I will ashamed to admit to her later.

So, I just dumped the remainder of what I've been selling for a few months. The gain was 3,731% with an average cost basis of $9.21/share. I bought in in 2013.

This was a decision based on my own personal moral values - call it value investing if you want - but there are also compelling financial reasons given Tesla's economic outlook and the recent negative consequences of Musk's antics on sales. Unfortunately, my conscience won't be fully clear since I also have two big Powerwall 2s in my garage that I can't dispose of as easily as I did my TSLA shares.

Just wanted to commemorate my decision with a post here. No more TSLA!"
"If you're buying TSLA @ $250, you better be really, really, REALLY sure a non-negligible number of human beings want to be seen driving this",16327,https://i.redd.it/dasmwqhr1qlb1.png,
500k on $TSLA calls wish me luck,3712,https://i.redd.it/18x5m41rhrie1.png,
Tesla (TSLA) Stock: Trump’s Purchase Fails to Sustain Rally,4268,https://www.reddit.com/r/stocks/comments/1jaciwt/tesla_tsla_stock_trumps_purchase_fails_to_sustain/,"Who knew that the publicity stunt on the WH lawn and a clear attempted pump wouldn't last. Do not buy the dip!

https://moneycheck.com/tesla-tsla-stock-trumps-purchase-fails-to-sustain-rally/

Tesla’s stock price continues to show volatility in early March trading, falling 0.9% in premarket activity after two days of gains. This follows Monday’s steep 15.4% drop that marked the company’s worst trading day in nearly five years.

The electric vehicle maker saw its shares rebound 7.6% on Wednesday and 3.8% on Tuesday. These gains came after President Donald Trump’s public commitment to purchase a Tesla Model S during a White House event with CEO Elon Musk.

Despite the recent uptick, Tesla stock remains down almost 50% from its mid-December record high. The current price hovers around $245.75 in premarket trading."
Stop buying $TSLA puts,4288,https://i.redd.it/d2yx7b01awqe1.png,"Hello Regard,

I have consistently been buying $TSLA puts every time it pumps and made decent money but guys, this time it's different. A 13% pump simply due to ""softer tariffs"" makes no sense. $NVDA and the SPY have not been moving like $TSLA this past week. Again, a sudden pump to +4% just before closing is very sus. They are somehow managing to trap the retail virgin. How can a stock skyrocket 13% literally after they announce that they lost 44% sales in Europe? When $INTC reported an 8b loss, it lost 30% valuation in 30 minutes. Intuitive Machine($LUNR) lost 50% valuation because they didn't land something on the moon, idk.

At 3:05PM I noticed a 12M BUY Volume on $TSLA on my Robinhood App. The same thing happened yesterday on closing, someone bought 2M stock. This is not retail investor, This is Elmo and 🥭 cooking up some massive scam which is going to completely cook the retail investor and us, WSB Put buyers. I have made good money buying $TSLA puts but today I have made the cumulative decision to stay away from them. 

Elmo is planning something big and our PUTS will be fucked. 

I felt that one of us must address this problem and warn the others about Elmo."
Its all over for TSLA,11530,https://i.redd.it/lspjnjk102wc1.jpeg,
Elon Musk's Brother Kimbal Musk And Other Tesla Execs Sell Over $73 Million In Stock - Tesla (NASDAQ:TSLA),5640,https://www.benzinga.com/tech/25/02/43557967/elon-musks-brother-kimbal-musk-and-other-tesla-execs-sell-over-73-million-in-stock,
Loading up on $tsla puts tomorrow.,7189,https://i.redd.it/rbwigwn1mzdd1.jpeg,
Elon Musk tries and fails to pump Tesla’s stock (TSLA),3551,https://www.reddit.com/r/stocks/comments/1j3ibxk/elon_musk_tries_and_fails_to_pump_teslas_stock/,"Elon Musk tried to pump Tesla’s stock (TSLA) by claiming a 10x increase in profits, but it failed. In fact, the stock is down 10% since Musk’s pump.

After an analyst posted a prediction that Tesla would increase its profits by 256%, Tesla CEO Elon Musk responded

>It will require outstanding execution, but I think more like 1000% gain for Tesla in 5 years is possible.

The comment was quickly propagated by Elon fans and the community of “Tesla all-ins” as being a sign that Musk, who is quite busy with X and DOGE lately, still believes in Tesla.

full article: [https://electrek.co/2025/03/04/elon-musk-tries-and-fails-to-pump-teslas-stock-tsla/](https://electrek.co/2025/03/04/elon-musk-tries-and-fails-to-pump-teslas-stock-tsla/)"
Is the gig up for $TSLA?,1850,https://i.redd.it/65nc590pa3qe1.jpeg,
bearish on $TSLA,36994,https://i.redd.it/0j6qrq71p3a91.jpg,
"is it just me, or does elon scramble to bring some gimmick to press every time TSLA share price starts dropping? 🤔",31975,https://i.redd.it/ooqmfbx4sir91.jpg,
Thank you Elon! $TSLA $10k to $149k in under a week,5004,https://i.redd.it/k519nqm4xc0e1.jpeg,Opened a lotto account last week after the elections and full send $TSLA FDs . Holding 49 contracts $450c for 3/22/2025 for now. 
Why TSLA is a buy.,2381,https://www.reddit.com/r/RealTesla/comments/1js68xu/why_tsla_is_a_buy/,"**Intro**

Okay, so Telsa has had not the greatest of starts to the year. With the stock being down something like 50% from the top.

But sometimes one just needs to take a step back and remember what is going on at Tesla and why it will make the stock pop off.

**The Cyberbeast**

Tesla now has a killer truck on the market. Sharp, angular, fast and just absolutely kills. Sure, it's had a couple of recalls (8) but that's just normal for all new cars on the market.

**Not just a car company**

One thing to remember about Tesla is that it's not just a car company it's also a bet on taxis. You know that thing you use like once or twice a year. Man I wish Tesla was a taxi company. Then we could be valued like Waymo or Uber and not like a boring car company.

Oh, and Tesla also does these robots that are really cool. That definitely are 100% AI* (actually interns). I think there is this other company called boston dynamics also doing robots and they where sold to Hyundai for 1.1 billion dollars. Now that's a lot of money.

**Valuation**

Man, Teslas current valuation just sucks. I just don't see why people aren't more hype about the company. The P/E is a modest 117, a couple of weeks ago it was closer to 200. But I guess it's fine. The other MAG 7 are like in their 30s.

**Brand**

On a more positive note, Teslas brand image is on fire. Like, literally. And people are just going to want to se it becoming brighter now with Elon Musk work at DOGE.

**Conclusion**

At the end of the day, you just have to zoom out. Way out. Like, to a level where fundamentals, earnings, and reality don’t really matter. And when you do that? Then it all just makes perfect sense.


I hope you liked my satirical little post. I originally posted it on WSB but it got removed so  i hope this is a better forum."
